{
  "schema_version": "design_spec_bundle.v1",
  "query": {
    "room": "kitchen",
    "style": "black_wood_gold",
    "budget": null
  },
  "tokens": [
    {
      "name": "coordinated_medium_dark_wood_base",
      "builder_kinds": [
        "kc_corpo",
        "kc_porta",
        "kc_gaveta"
      ],
      "params": {
        "corpo_rgb": [
          101,
          74,
          53
        ],
        "porta_rgb": [
          108,
          80,
          58
        ],
        "gaveta_rgb": [
          108,
          80,
          58
        ],
        "finish": "fosco acetinado, veio madeira visķvel (médio/escuro quente)",
        "wood_tone": "nogueira / freijó / carvalho-fumź (médio a escuro, NUNCA claro nem branco)",
        "base_depth_cm": 60,
        "base_depth_range_cm": [
          55,
          60
        ],
        "countertop_height_cm": 90,
        "countertop_height_range_cm": [
          85,
          92
        ],
        "module_width_cm": 50,
        "module_width_range_cm": [
          35,
          65
        ],
        "drawer_rows_per_drawer_module": 3,
        "handleless": true,
        "handle_strategy": "cava / gola / perfil J / push-amortecedor (ver premium_shadow_gap) — sem puxador de barra tradicional",
        "wetzone_material": "pedra/inox na zona molhada e quente (madeira nćo toca pia/cooktop)"
      },
      "source_path": "references/tokens/coordinated_medium_dark_wood_base.json",
      "cost_relative": "médio (laminado/melamina madeirado médio-escuro é padrćo); madeira natural folheada = médio-alto"
    },
    {
      "name": "coordinated_oak_base",
      "builder_kinds": [
        "kc_corpo",
        "kc_porta",
        "kc_gaveta"
      ],
      "params": {
        "corpo_rgb": [
          191,
          167,
          137
        ],
        "porta_rgb": [
          195,
          171,
          141
        ],
        "gaveta_rgb": [
          195,
          171,
          141
        ],
        "finish": "fosco acetinado, veio madeira sutil",
        "base_depth_cm": 60,
        "base_depth_range_cm": [
          55,
          60
        ],
        "countertop_height_cm": 90,
        "countertop_height_range_cm": [
          85,
          92
        ],
        "module_width_cm": 50,
        "module_width_range_cm": [
          35,
          65
        ],
        "drawer_rows_per_drawer_module": 3
      },
      "source_path": "references/tokens/coordinated_oak_base.json",
      "cost_relative": "médio (laminado/melamina madeirado claro é padrćo)"
    },
    {
      "name": "dark_stainless_appliance",
      "builder_kinds": [
        "kc_geladeira",
        "kc_inox",
        "kc_vidro",
        "kc_boca"
      ],
      "params": {
        "dark_stainless_rgb": [
          82,
          84,
          84
        ],
        "cooktop_glass_rgb": [
          22,
          22,
          26
        ],
        "finish": "inox dark satin reflexivo (NĆO fosco morto)",
        "integration": "torre/coluna integrada; geladeira em nicho planejado",
        "daylight_reflection": true
      },
      "source_path": "references/tokens/dark_stainless_appliance.json",
      "cost_relative": "médio (linha inox dark / black steel é comum)"
    },
    {
      "name": "discreet_bronze_hardware",
      "builder_kinds": [
        "kc_puxador"
      ],
      "params": {
        "bronze_rgb": [
          171,
          119,
          63
        ],
        "finish": "escovado fosco discreto (nćo polido espelhado dourado)",
        "where_yes": [
          "perfil de gola/cava",
          "aro de nicho",
          "faixa fina vertical perto da torre"
        ],
        "where_no": [
          "puxador-alēa aparente",
          "superfķcie grande",
          "todos os módulos"
        ],
        "coverage_max": "detalhe (<5% da leitura visual)"
      },
      "source_path": "references/tokens/discreet_bronze_hardware.json",
      "cost_relative": "baixo-médio (perfil/acabamento, nćo ferragem de luxo)"
    },
    {
      "name": "hot_tower_niche",
      "builder_kinds": [
        "kc_niche_wood",
        "kc_filler",
        "kc_porta_vidro",
        "kc_inox",
        "kc_soculo",
        "kc_puxador"
      ],
      "params": {
        "tower_width_cm": 62,
        "tower_width_range_cm": [
          60,
          65
        ],
        "tower_depth_cm": 60,
        "tower_depth_range_cm": [
          55,
          60
        ],
        "tower_height_m": 2.1,
        "oven_niche_width_cm": 60,
        "oven_door_center_height_cm": 90,
        "oven_door_height_range_cm": [
          80,
          100
        ],
        "oven_vent_gap_rear_cm": 4,
        "micro_niche_above_oven": true,
        "micro_center_height_cm": 150,
        "micro_center_height_range_cm": [
          140,
          160
        ],
        "micro_vent_gap_cm": 3,
        "airfryer_niche": "nicho ventilado com prateleira/apoio puxįvel; respiro lateral+traseiro",
        "airfryer_pullout_shelf": true,
        "outlet_per_niche": true,
        "outlet_note": "1 tomada interna oculta por nicho, na voltagem do aparelho (forno/cooktop podem exigir 220V)",
        "front_flush": true,
        "filler_width_cm": 16,
        "filler_width_range_cm": [
          15,
          18
        ],
        "filler_rgb": [
          108,
          80,
          58
        ],
        "appliance_face_rgb": [
          44,
          44,
          48
        ],
        "position": "ponta do layout linear OPOSTA ą torre da geladeira; encostada na parede de fundo (PDF manda — nćo mover pia/ponto/parede)",
        "handleless": true
      },
      "source_path": "references/tokens/hot_tower_niche.json",
      "cost_relative": "alto (coluna dedicada + 2-3 nichos com respiro/tomada + eletros embutidos consomem 1 módulo cheio de marcenaria), mas é requisito OBRIGATÓRIO do Felipe e o que separa planejado de avulso"
    },
    {
      "name": "matte_black_cabinetry",
      "builder_kinds": [
        "kc_corpo",
        "kc_porta",
        "kc_gaveta",
        "kc_corpo_sup",
        "kc_porta_sup",
        "kc_filler"
      ],
      "params": {
        "matte_black_rgb": [
          24,
          24,
          24
        ],
        "graphite_rgb": [
          38,
          39,
          40
        ],
        "finish": "fosco a satin leve (nćo brilho espelhado, nćo morto)",
        "handle_system": [
          "cava",
          "gola",
          "perfil_j",
          "push_amortecedor"
        ],
        "compensation_required": [
          "warm_wood_accent",
          "warm_2700k_led",
          "dark_gold_veined_stone"
        ]
      },
      "source_path": "references/tokens/matte_black_cabinetry.json",
      "cost_relative": "médio (MDF laqueado/melamķnico preto fosco é comum; o custo estį na coordenaēćo dos acentos)"
    }
  ],
  "palette": {
    "corpo": [
      101,
      74,
      53
    ],
    "porta": [
      108,
      80,
      58
    ],
    "gaveta": [
      108,
      80,
      58
    ],
    "dark_stainless": [
      82,
      84,
      84
    ],
    "cooktop_glass": [
      22,
      22,
      26
    ],
    "bronze": [
      171,
      119,
      63
    ],
    "filler": [
      108,
      80,
      58
    ],
    "appliance_face": [
      44,
      44,
      48
    ],
    "matte_black": [
      24,
      24,
      24
    ],
    "graphite": [
      38,
      39,
      40
    ]
  },
  "anti_patterns": [
    "Carvalho CLARO ou branco puro embaixo (nćo é o gosto do Felipe). Madeira escura + aéreo branco frio = bicolor builder-grade frio. Madeira na zona molhada/quente sem proteēćo (mancha/incha — maintenance_gate). Laca brilhante que esconde o veio (a graēa da madeira média/escura é o veio). Puxador de barra tradicional (Felipe rejeita).",
    "Carvalho mel/escuro embaixo + aéreo branco em cima = bicolor builder-grade frio (o defeito que este token corrige). Também: base e porta de tons muito diferentes = leitura remendada.",
    "Inox cinza-escuro FOSCO = bloco morto sem reflexo (reprova daylight_reflection). Geladeira solta sem nicho = loose_object. Forno longe do cooktop/preparo = fluxo burro (appliance_workflow_check).",
    "Puxador dourado demais / alēa dourada aparente = ostentaēćo fake. Dourado espalhado em muitos módulos = mansćo fake Pinterest. Bronze brilhante espelhado quebra o moody premium.",
    "Forno embaixo do cooktop 'porque sempre foi' quando o projeto pede coluna (perde a ergonomia de nćo abaixar). Micro na bancada (loose_object que come įrea de trabalho) ou alto demais (prato quente acima da cabeēa = perigo). Airfryer largado no tampo. Nicho selado sem respiro (superaquece, queima). Nicho sem tomada (gambiarra de extensćo). Torre quente colada na torre da geladeira (calor + frio juntos = ineficiźncia; appliance_workflow_check). Vćo morto aberto no topo (pega pó). Puxador de barra tradicional (Felipe rejeita).",
    "Preto puro [0,0,0] chapado e fosco-total sem reflexo = caverna / bloco morto. Massa preta sem madeira/LED/pedra de compensaēćo reprova no cave_check. Puxador-alēa aparente quebra a leitura handle-less.",
    "Braēo largo reto · sem pé que erga · módulos cśbicos · encosto tįbua reta · zero raio/chanfro nas quinas."
  ],
  "layout_hints": [
    "hot_tower_niche: ponta do layout linear OPOSTA ą torre da geladeira; encostada na parede de fundo (PDF manda — nćo mover pia/ponto/parede)"
  ],
  "gate_refs": [
    "tools/kitchen_ergonomics.py::base_depth",
    "tools/kitchen_ergonomics.py::countertop_height",
    "tools/kitchen_ergonomics.py::base_module_width",
    "reference_system_gates.md::maintenance_gate (madeira fora da zona molhada/quente)",
    "reference_system_gates.md::cave_check (nćo escurecer demais o compacto)",
    "artifacts/reference_lab/gates/reference_system_gates.md::daylight_reflection_check",
    "artifacts/reference_lab/gates/reference_system_gates.md::appliance_workflow_check",
    "artifacts/reference_lab/gates/reference_system_gates.md::fake_luxury_check",